created_at,id_str,full_text,quote_count,reply_count,retweet_count,favorite_count,lang,user_id_str,conversation_id_str,username,tweet_url
Mon Sep 11 23:00:59 +0000 2023,1.70137E+18,Bengkel Resmi Toyota Ini Berencana Hadirkan Layanan Pengecasan Mobil Listrik Berjalan Pengembangan ini selaras dengan peningkatan kendaraan listrik di Indonesia,0,0,0,0,in,1.39057E+18,1.70133E+18,Dirjasu6,https://twitter.com/Dirjasu6/status/1701325980500164750
Mon Sep 11 22:00:56 +0000 2023,1.70136E+18,Pemprov DKI Permudah PNS Beli Kendaraan Listrik,0,0,0,0,in,249095742,1.70128E+18,bramptonRBS,https://twitter.com/bramptonRBS/status/1701275817861587197
Mon Sep 11 20:04:57 +0000 2023,1.70133E+18,KITA LEBIH BUTUH BERAS DRPD INFRASTRUKTUR DAN KENDARAAN LISTRIK?  Jokowi Ungkap Rencana Impor Beras Lagi Tahun Depan https://t.co/45pMVVuLIz,0,3,0,0,in,1.02532E+18,1.70127E+18,karinea,https://twitter.com/karinea/status/1701265738064089108
Mon Sep 11 16:45:37 +0000 2023,1.70128E+18,gagasan bahwa kendaraan listrik menghasilkan emisi lebih tinggi dibandingkan kendaraan bensin/diesel jika ditenagai oleh listrik berbahan bakar fosil telah dibantah oleh banyak penelitian ilmiah. https://t.co/uEJokkPwpj,0,0,0,1,in,18071520,1.70123E+18,antaranews,https://twitter.com/antaranews/status/1701232033651904835
Mon Sep 11 16:05:34 +0000 2023,1.70127E+18,⠀⠀⠀ 𖥻 ini kendaraan listrik kayak setan pas lewat cuma angin doang 😭 ⠀⠀⠀,0,0,0,0,in,41730943,1.70123E+18,VIVAcoid,https://twitter.com/VIVAcoid/status/1701230782059106747
Mon Sep 11 13:51:38 +0000 2023,1.70123E+18,Agus Gumiwang Kartasasmita memastikan pemerintahan Presiden Jokowi mengawal pemenuhan kebutuhan nikel yang terus meningkat seiring dengan pengembangan industri kendaraan listrik.  https://t.co/DiQkr9TW8e,0,0,1,8,in,2392460208,1.70123E+18,jawapos,https://twitter.com/jawapos/status/1701225833044607281
Mon Sep 11 13:46:40 +0000 2023,1.70123E+18,Kemenperin Targetkan TKDN Kendaraan Listrik 80 Persen di 2030  https://t.co/7fczbM8Iu4,0,0,0,0,in,8.74558E+17,1.70122E+18,validnewsid,https://twitter.com/validnewsid/status/1701222950853366114
Mon Sep 11 13:27:00 +0000 2023,1.70123E+18,United E-Motor  Merek Lokal Indonesia Akan Buka Pabrik Kendaraan Listrik di Malaysia  https://t.co/crUykYbGoo,0,0,0,0,in,153718689,1.70118E+18,muh_syafri,https://twitter.com/muh_syafri/status/1701217426548072687
Mon Sep 11 13:15:33 +0000 2023,1.70122E+18,Smelter nikel baru diharapkan bisa dorong ekosistem kendaraan listrik dengan hilirisasi nikel. https://t.co/iPUyPkLWpb,0,0,0,0,in,611082711,1.70119E+18,alexmarten4,https://twitter.com/alexmarten4/status/1701193753892184506
Mon Sep 11 12:53:36 +0000 2023,1.70122E+18,@kurawa Mantap setelah hampir semua pakai kendaraan listrik 👏👏👏,0,0,0,0,in,1.68352E+18,1.70119E+18,__longbaobao,https://twitter.com/__longbaobao/status/1701192174346645529
Mon Sep 11 11:45:38 +0000 2023,1.7012E+18,Kendaraan listrik adalah langkah positif untuk mengurangi polusi udara,0,0,0,0,in,2199779503,1.70118E+18,CiputCi,https://twitter.com/CiputCi/status/1701190130395197839
Mon Sep 11 11:43:49 +0000 2023,1.7012E+18,@narkosun BBM bukan kebutuhan primer Pak Jokowi udh mau menghapus subsidi secara perlahan dan mengganti ke kendaraan listrik,0,0,0,0,in,1.171E+18,1.70118E+18,AsosiasiNikel,https://twitter.com/AsosiasiNikel/status/1701177571810082990
Mon Sep 11 11:19:32 +0000 2023,1.70119E+18,Insentif Kendaraan Listrik Sangat Penting https://t.co/zLhbLuLI1j lewat @Berita Moneter Dan Keuangan,0,0,0,0,in,1.46665E+18,1.70118E+18,media_nikel,https://twitter.com/media_nikel/status/1701177512095846855
Mon Sep 11 11:13:15 +0000 2023,1.70119E+18,Gak kayak disini malah disuruh beli kendaraan listrik wkwkwkwk,0,0,0,0,in,1.44381E+18,1.69935E+18,Profesor_Zonk,https://twitter.com/Profesor_Zonk/status/1701161207036772512
Mon Sep 11 11:05:08 +0000 2023,1.70119E+18,@kurawa Yg tereak2 biar kendaraan listrik laku...mana2..,0,2,4,13,in,239183027,1.70109E+18,nitz_gokil,https://twitter.com/nitz_gokil/status/1701158088643084351
Mon Sep 11 11:02:05 +0000 2023,1.70119E+18,Korps Lalu Lintas Polri baru-baru ini mengusulkan penggunaan kendaraan listrik untuk patroli anggota mereka,0,0,0,1,in,238091066,1.70116E+18,InvestorID,https://twitter.com/InvestorID/status/1701157409614594309
Mon Sep 11 10:38:18 +0000 2023,1.70118E+18,Kendaraan Listrik jadi Sorotan di KTT ASEAN,0,0,0,0,in,1.56402E+18,1.70114E+18,tinewssofficial,https://twitter.com/tinewssofficial/status/1701135123994071142
Mon Sep 11 10:27:11 +0000 2023,1.70118E+18,Telat Kembangkan Kendaraan Listrik,0,0,0,1,in,3024156987,1.70113E+18,otodriver,https://twitter.com/otodriver/status/1701131418120737264
Mon Sep 11 10:15:14 +0000 2023,1.70118E+18,Kemenperin Terbitkan Roadmap Pengembangan Kendaraan Listrik Berbasis Baterai  https://t.co/VkRJizprXW https://t.co/UNqEUW094v,1,0,0,1,in,7.90585E+17,1.70112E+18,weclfare,https://twitter.com/weclfare/status/1701124922347815270
Mon Sep 11 10:14:59 +0000 2023,1.70118E+18,Kemenperin Terbitkan Roadmap Pengembangan Kendaraan Listrik Berbasis Baterai  https://t.co/27PzAQDphO https://t.co/WYQhNAvpJX,0,0,0,0,in,333877701,1.70112E+18,BisniscomJatim,https://twitter.com/BisniscomJatim/status/1701123800820269190
Mon Sep 11 09:50:55 +0000 2023,1.70117E+18,@renita_hartini @nadeuxx @AREAJULID Yg punya tambang batu bara pemasok PLTU tuh yg punya usaha kendaraan listrik,0,0,0,0,in,1.3913E+18,1.70112E+18,firstindomagz,https://twitter.com/firstindomagz/status/1701123541327089666
Mon Sep 11 09:10:12 +0000 2023,1.70116E+18,@HeryIdris5 Kendaraan listrik itu wajib diperhitungkan https://t.co/tfMBhCjIBS,0,0,0,2,in,1.59257E+18,1.70112E+18,Xone_ofc,https://twitter.com/Xone_ofc/status/1701121065433678218
Mon Sep 11 08:57:48 +0000 2023,1.70116E+18,@RadioElshinta Bukannya itu mobil sedang bertugas ? Bertugas menambah polusi. Biar yakin bahwa butuh kendaraan listrik untuk solusinya mudahnya *kata pejabat yg main usaha kendaraan listrik 🤣,0,1,0,0,in,475624418,1.70112E+18,SahabatPLNJkt,https://twitter.com/SahabatPLNJkt/status/1701119289686978914
Mon Sep 11 08:55:07 +0000 2023,1.70116E+18,Pengunjung BCA Expo 2023 dapat menggali informasi mengenai kendaraan listrik idaman https://t.co/uNZwRMd0Ty,0,0,0,0,in,80543284,1.70112E+18,detikoto,https://twitter.com/detikoto/status/1701118668846117202
Mon Sep 11 08:11:41 +0000 2023,1.70115E+18,saya akan melakukan program konversi kendaraan listrik ke mesin internal combustion serta menurunkan standar emisi euro 4 ke euro 1-2,0,0,1,1,in,1.63622E+18,1.70112E+18,Riaumakmurcom,https://twitter.com/Riaumakmurcom/status/1701116697086996738
Mon Sep 11 07:32:39 +0000 2023,1.70114E+18,Tak hanya beralih ke kendaraan listrik,0,0,0,0,in,1.10279E+18,1.70111E+18,100kpjcom,https://twitter.com/100kpjcom/status/1701105805854998722
Mon Sep 11 07:26:33 +0000 2023,1.70114E+18,PT SGMW Motors ( Wuling Indonesia) telah memastikan jika pihaknya akan lebih banyak luncurkan produk kendaraan listrik di Indonesia. https://t.co/cXUxvG4hjR,0,0,0,0,in,336881623,1.70105E+18,andee_iswan,https://twitter.com/andee_iswan/status/1701103126349312435
Mon Sep 11 07:11:50 +0000 2023,1.70113E+18,Program Akselerasi Kendaraan Listrik di Indonesia Hingga 2040 Pemerintah tengah menjalankan program akselerasi kendaraan listrik di Indonesia hingga tahun 2040. https://t.co/343QshgFZM,0,0,0,0,in,1.30933E+18,1.7011E+18,NTMC_Info,https://twitter.com/NTMC_Info/status/1701102547564675445
Mon Sep 11 06:46:01 +0000 2023,1.70112E+18,Emisi gas karbon dari kendaraan pribadi seperti mobil dan sepeda motor menjadi penyumbang terbesar polusi udara di Jakarta. Prioritaskan kendaraan listrik dan dukung moda transportasi publik untuk mengurangi dampak polusi. https://t.co/wBauHlCx9V,0,1,0,0,in,388190238,1.7011E+18,IDNTimes,https://twitter.com/IDNTimes/status/1701095365079122071
Mon Sep 11 06:44:44 +0000 2023,1.70112E+18,90% polusi udara di Jakarta berasal dari kendaraan pribadi. Solusinya? Lebih banyak menggunakan kendaraan listrik dan memanfaatkan moda transportasi publik. Jaga kualitas udara Jakarta,0,0,0,2,in,231355136,1.70109E+18,SINDOnews,https://twitter.com/SINDOnews/status/1701088174678618138
Mon Sep 11 06:41:34 +0000 2023,1.70112E+18,Tren konsumsi penggunaan listrik untuk kendaraan listrik di Jatim tahun ini rerata mencapai 84.565 Kwh dengan total mencapai 4.206 transaksi. https://t.co/RAgMk2R2Op,0,1,4,14,in,1.63757E+18,1.70109E+18,liaasister,https://twitter.com/liaasister/status/1701086662892106051
Mon Sep 11 06:40:32 +0000 2023,1.70112E+18,Insentif Kendaraan Listrik &amp  Kebijakan Lainnya Diperlukan untuk Capai Net Zero Emisi.  Selengkapnya: https://t.co/Oe3iUe1nmf,0,1,1,0,in,145105148,1.70108E+18,yang_rajin,https://twitter.com/yang_rajin/status/1701086085416468724
Mon Sep 11 06:30:41 +0000 2023,1.70112E+18,Peralihan ke kendaraan listrik Indonesia mulai berjalan tetapi lamban karna masyarakat masih menggunakan kendaraan Konvensional yg menurut mereka lebih nyaman tetapi kenyamanan itu tidak bagi jakarta sekarang yg terkena Polusi https://t.co/xLA6uF4UM3  Sule Alba Baptista Bobby https://t.co/4zR5oVMi7y,0,0,0,1,in,3024156987,1.70108E+18,otodriver,https://twitter.com/otodriver/status/1701083559732166671
Mon Sep 11 06:23:38 +0000 2023,1.70112E+18,PLN UID Jakarta Raya sukses menyediakan infrastruktur pendukung kendaraan listrik di kawasan Gelora Bung Karno (GBK) selama KTT ke-43 ASEAN.  Sebanyak 74 Stasiun Pengisian Kendaraan Listrik Umum (SPKLU) beroperasi mulai tanggal 31 Agustus 2023 hingga 7 September 2023. https://t.co/4Xt8yWNWmG,0,0,0,0,in,403843119,1.70078E+18,DonnyJordan1,https://twitter.com/DonnyJordan1/status/1701080101453222121
Mon Sep 11 06:21:10 +0000 2023,1.70112E+18,Kemenperin: TKDN Kendaraan Listrik Ditargetkan 80 Persen pada 2030 https://t.co/n0kcHpqiCW,0,0,0,0,in,1.64091E+18,1.70107E+18,surabayapagi_id,https://twitter.com/surabayapagi_id/status/1701069779048829220
Mon Sep 11 06:13:20 +0000 2023,1.70112E+18,Presiden Jokowi Minta Italia Berinvestasi Ekosistem Kendaraan Listrik di IKN  https://t.co/5axjqxErQk,0,0,0,0,in,1.38002E+18,1.70107E+18,Fortune_IDN,https://twitter.com/Fortune_IDN/status/1701067680521007357
Mon Sep 11 06:10:49 +0000 2023,1.70112E+18,Kejar Jadi Raja Kendaraan listrik Dunia,1,0,0,0,in,46647466,1.70106E+18,Bambangelf,https://twitter.com/Bambangelf/status/1701066286162444490
Mon Sep 11 06:10:32 +0000 2023,1.70112E+18,Kejar Jadi Raja Kendaraan listrik Dunia,0,0,1,0,in,552523769,1.70105E+18,KATADATAcoid,https://twitter.com/KATADATAcoid/status/1701050696576217389
Mon Sep 11 05:51:24 +0000 2023,1.70111E+18,Sudah dmulai para PESOHOR2 dunia HIBURAN  dgn propaganda membeli memamerkan pembelian KENDARAAN LISTRIK di semua platform sosial media,0,2,0,0,in,363539017,1.70104E+18,AndyartaPutra,https://twitter.com/AndyartaPutra/status/1701044111577645438
Mon Sep 11 05:30:03 +0000 2023,1.70111E+18,Kementerian Perindustrian (Kemenperin) menyatakan telah mengambil langkah signifikan dengan menerbitkan Peta Jalan Pengembangan Kendaraan Listrik Berbasis Baterai.  Selengkapnya: https://t.co/j1CQ8A65cD ___ #100kpjcom #Kemenprin #TKDN https://t.co/Jx8FSfIgU9,0,0,0,0,in,1.45032E+18,1.70104E+18,trenotoid,https://twitter.com/trenotoid/status/1701037862807118128
Mon Sep 11 05:19:24 +0000 2023,1.7011E+18,@SelamanyaPutih @mediocrickey @CNNIndonesia @psi_id Gratis lah khusus pengguna kendaraan listrik,0,1,0,0,in,171386530,1.70102E+18,plndisjatim,https://twitter.com/plndisjatim/status/1701021849755471955
Mon Sep 11 05:17:06 +0000 2023,1.7011E+18,Ratusan Masyarakat Ikut Ramaikan Gelaran Fun Run dan Display Kendaraan Listrik Korlantas Polri di GBK  https://t.co/BJtdrK4ZpB,0,0,0,0,in,68930552,1.70102E+18,mediaindonesia,https://twitter.com/mediaindonesia/status/1701020226991669739
Mon Sep 11 05:00:40 +0000 2023,1.7011E+18,ASEAN akan memperkuat ekosistem kendaraan listrik,0,0,0,1,in,1.09737E+18,1.70076E+18,MOHAMAD26051170,https://twitter.com/MOHAMAD26051170/status/1701019813685199078
Mon Sep 11 04:48:34 +0000 2023,1.7011E+18,Korlantas Polri Usul Mobil Patroli Gunakan Kendaraan Listrik https://t.co/IROMmCdgej,0,0,0,0,in,1.62082E+18,1.70071E+18,EH_KAGET_01,https://twitter.com/EH_KAGET_01/status/1701015420407595180
Mon Sep 11 04:20:00 +0000 2023,1.70109E+18,Polri Akan Ganti Mobil Patroli dengan Kendaraan Listrik https://t.co/jNpWe7rRpE,0,0,0,0,in,2267149047,1.70078E+18,triagungsantos1,https://twitter.com/triagungsantos1/status/1701014174388867340
Mon Sep 11 04:13:59 +0000 2023,1.70109E+18,Duh..ujung2nya jualan kendaraan listrik🤦‍♂️ https://t.co/49QqLtUxFw,0,0,0,0,in,1.64925E+18,1.70072E+18,SuhendiWiw94288,https://twitter.com/SuhendiWiw94288/status/1701013889188806967
Mon Sep 11 04:11:42 +0000 2023,1.70109E+18,@kisbet_ @zarryhendrik Setuju dengan pemikiran @pemudaidamanid   Analoginya hampir sama dgn lebih baik siapkan dana utk perbaiki transportasi publik daripada kasih insentif utk kendaraan listrik.,0,0,1,1,in,1.10279E+18,1.70101E+18,100kpjcom,https://twitter.com/100kpjcom/status/1701010804815077520
Mon Sep 11 04:01:39 +0000 2023,1.70108E+18,Pemerintah Targetkan TKDN Kendaraan Listrik Mencapai 80 Persen pada 2030 Menteri Perindustrian menargetkan kendaraan listrik yang diproduksi lokal harus memiliki Tingkat Komponen Dalam Negeri (TKDN) kendaraan listrik mencapai 80 persen pada 2030. https://t.co/ohed4wsY4x,0,0,0,1,in,41730943,1.70101E+18,VIVAcoid,https://twitter.com/VIVAcoid/status/1701010804638953884
Mon Sep 11 03:47:55 +0000 2023,1.70108E+18,@narkosun BBM gratis untuk kendaraan listrik mungkin kamsudnya,0,0,0,0,in,1.61957E+18,1.70076E+18,azizusman583,https://twitter.com/azizusman583/status/1700938945864028457
Mon Sep 11 03:23:02 +0000 2023,1.70107E+18,Presiden Joko Widodo (Jokowi) menyambut baik komitmen peningkatan kerja sama investasi antara Indonesia dan Republik Korea Selatan dalam pengembangan ekosistem industri baterai kendaraan listrik senilai US$9,,,,,,,,,
Mon Sep 11 03:09:23 +0000 2023,1.70107E+18,@CNNIndonesia bikin transportasi alias kendaraan listrik angkutan umum,,,,,,,,,
Mon Sep 11 03:06:54 +0000 2023,1.70107E+18,Konvoi 100 kendaraan listrik menggandeng komunitas motor listrik ini melaju dari kantor PLN Distribusi Jawa Timur menuju titik finish Taman Bungkul. #ChrisEvans #garnacho #klaten  https://t.co/um30nqDJ49,,,,,,,,,
Mon Sep 11 02:58:34 +0000 2023,1.70107E+18,Menperin Targetkan TKDN Kendaraan Listrik pada 2030 Capai 80 Persen https://t.co/PtckS9Ka9X,,,,,,,,,
Mon Sep 11 02:53:01 +0000 2023,1.70107E+18,@giIangmahesa PKB termasuk kelompok yg ingin riset soal kendaraan listrik harus ditingkatkan lagi. Bukan hanya soal menjual. Transisi menggantikan 120juta sepeda motor combustion butuh waktu yang sifatnya evolutif seiring dg penyempurnaan teknologi EV.,,,,,,,,,
Mon Sep 11 02:11:34 +0000 2023,1.70106E+18,PLN klaim penggunaan kendaraan listrik semakin masif,,,,,,,,,
Mon Sep 11 01:51:04 +0000 2023,1.70105E+18,MBMA Gandeng KDB Genjot Bisnis Baterai Kendaraan Listrik https://t.co/F7Jt15cd8c,,,,,,,,,
Mon Sep 11 01:24:54 +0000 2023,1.70104E+18,@faizlabib Kira kira apa solusi yang solutif? Ganti kendaraan listrik? Ganji pj? Ganti warga?  😂😂😂😂,,,,,,,,,
Mon Sep 11 01:01:05 +0000 2023,1.70104E+18,Kakorlantas Usulkan Patroli Gunakan Kendaraan Listrik,,,,,,,,,
Mon Sep 11 01:00:04 +0000 2023,1.70104E+18,Pemerintah targetkan kandungan lokal kendaraan listrik capai 80 persen di 2030 lewat skema dari Kemenperin https://t.co/6Z3uDPp57S,,,,,,,,,
Mon Sep 11 00:25:47 +0000 2023,1.70103E+18,Disaat Pemerintah gencar menganjurkan Pemakaian Kendaraan Listrik ,,,,,,,,,
Sun Sep 10 23:56:27 +0000 2023,1.70102E+18,Semoga warga Jawa Timur segera bertransisi menggunakan kendaraan listrik dan piranti kelistrikan lainnya karena selain aman,,,,,,,,,
Sun Sep 10 23:56:27 +0000 2023,1.70102E+18,Direktur Distribusi PT PLN (Persero) hadir langsung memberikan edukasi kepada masyarakat tentang kemudahan menggunakan kendaraan listrik yang tanpa polusi.,,,,,,,,,
Sun Sep 10 23:50:00 +0000 2023,1.70102E+18,Presiden Joko Widodo dan Perdana Menteri (PM) Italia Giorgia Meloni membahas sejumlah kerja sama dan investasi Italia di Indonesia. Salah satunya ajakan Indonesia agar Itali mendukung ekosistem baterai untuk kendaraan listrik.  https://t.co/4d8F3zI9fH,,,,,,,,,
Sun Sep 10 23:48:21 +0000 2023,1.70102E+18,@Ngukzx @CNNIndonesia PLTU yg energinya dari Batu Bara itu yaa bos...makasih atas infonya..pantesan proyek kendaraan listrik dipercepat..dia2 juga toh penyebab nya...ish...ish...ish...,,,,,,,,,
Sun Sep 10 23:44:34 +0000 2023,1.70102E+18,Terpopuler: Pasar Kendaraan Listrik Belum Antusias,,,,,,,,,
Sun Sep 10 23:30:54 +0000 2023,1.70102E+18,@KompasTV Demi dapat cuan dari bisnis kendaraan listrik...,,,,,,,,,
Sun Sep 10 23:25:57 +0000 2023,1.70101E+18,@narkosun bukan ud mo k jaman kendaraan listrik yg ramah lingkungan ???,,,,,,,,,
Sun Sep 10 23:24:49 +0000 2023,1.70101E+18,@detikcom Jualan kendaraan listrik jg. Kok para pejabat begitu tolol ya,,,,,,,,,
Sun Sep 10 23:12:33 +0000 2023,1.70101E+18,Kemenperin Targetkan TKDN Kendaraan Listrik 80 Persen di 2030 https://t.co/qCCJqcgNO0,,,,,,,,,
Sun Sep 10 23:12:33 +0000 2023,1.70101E+18,Kemenperin Targetkan TKDN Kendaraan Listrik 80 Persen di 2030 #Ramadan https://t.co/cwzNm7r5v4 https://t.co/CGE26OkWMB,,,,,,,,,
Sun Sep 10 18:27:01 +0000 2023,1.70094E+18,@psi_id Kendaraan listrik jalan satu satunya,,,,,,,,,
